{
    "$schema": "http://json-schema.org/draft-04/schema#",
    "type": "object",
    "properties": {
      "id": {
        "type": "string"
      },
      "firstName": {
        "type": "string"
      },
      "lastName": {
        "type": "string"
      },
      "age": {
        "type": "integer"
      },
      "occupation": {
        "type": "string"
      },
      "nationality": {
        "type": "string"
      },
      "hobbies": {
        "type": "array",
        "items": [
          {
            "type": "string"
          }
        ]
      },
      "gender": {
        "type": "string"
      },
      "createdDate": {
        "type": "string"
      },
      "updatedDate": {
        "type": ["string", "null"]
      }
    },
    "required": [
      "id",
      "firstName",
      "lastName",
      "age",
      "occupation",
      "nationality",
      "hobbies",
      "gender",
      "createdDate",
      "updatedDate"
    ]
  }